{
  "report_version": "1.0.0",
  "report_schema_fingerprint": "sha256:aaaaaaaaaaaaaaaaaaaaaaaaaaaaaaaaaaaaaaaaaaaaaaaaaaaaaaaaaaaaaaaa",
  "profile": {
    "id": "dev.kurobara.plugin-conformance/local-v1",
    "version": "1.0.0",
    "fingerprint": "sha256:bbbbbbbbbbbbbbbbbbbbbbbbbbbbbbbbbbbbbbbbbbbbbbbbbbbbbbbbbbbbbbbb",
    "compatibility_matrix_fingerprint": "sha256:cccccccccccccccccccccccccccccccccccccccccccccccccccccccccccccccc"
  },
  "subject": {
    "package_name": "@kurobara/provider-example",
    "package_version": "1.0.0",
    "artifact_fingerprint": "sha256:dddddddddddddddddddddddddddddddddddddddddddddddddddddddddddddddd",
    "manifest_fingerprint": "sha256:eeeeeeeeeeeeeeeeeeeeeeeeeeeeeeeeeeeeeeeeeeeeeeeeeeeeeeeeeeeeeeee",
    "declared_plugin_id": "dev.kurobara.provider-example",
    "declared_plugin_version": "1.0.0"
  },
  "environment": {
    "node_version": "24.14.0",
    "platform": "darwin",
    "architecture": "arm64"
  },
  "toolchain": {
    "plugin_api_version": "dev.kurobara.plugin/v1",
    "protocol_api_version": "dev.kurobara.plugin-protocol/v1",
    "contracts_package_version": "0.1.0",
    "catalog_version": "0.8.0",
    "catalog_fingerprint": "sha256:ffffffffffffffffffffffffffffffffffffffffffffffffffffffffffffffff",
    "sdk_package_version": "0.1.0",
    "host_package_version": "0.1.0",
    "conformance_kit_version": "0.1.0"
  },
  "guarantees": [
    {
      "id": "compatibility.exact-versions",
      "status": "passed",
      "reason_codes": [],
      "evidence_refs": ["case:compatibility-exact"]
    }
  ],
  "summary": {
    "status": "passed",
    "passed": 1,
    "failed": 0,
    "not_applicable": 0,
    "total": 1
  }
}
